{
  "screen_run": {
    "id": "screen-2026-05-29-001",
    "timestamp": "2026-05-29T16:00:00+08:00",
    "data_source": "eastmoney_f10_api",
    "data_as_of": "2025Q1",
    "data_directory": "data/2026-05-29/",
    "total_banks": 42,
    "layers_completed": ["data_engineering", "quant", "edge", "qualitative", "synthesis"],
    "final_candidates": 12,
    "pipeline_version": "v1"
  },
  "candidates": [
    {
      "code": "SH601398",
      "name": "工商银行",
      "type": "traditional_commercial",
      "score": 82.5,
      "rank": 1,
      "dimension_scores": {
        "D1_capital_preservation": 88.0,
        "D2_asset_quality": 80.0,
        "D3_profitability": 75.0,
        "D4_growth": 70.0,
        "D5_valuation": 90.0
      },
      "flags": [],
      "reasons": "HIGH_CONFIDENCE_PASS: unanimous across all layers. Strong capital position and valuation safety margin.",
      "source_tracking": {
        "quant": {
          "status": "PASS",
          "confidence": "high",
          "curiosity": "Consistent across all metrics, strong capital position"
        },
        "edge": [],
        "qual": [
          {
            "group": "large_state_owned",
            "assessment": "PASS",
            "group_rank": 1
          }
        ],
        "override": null
      },
      "data_quality": {
        "completeness": 0.91,
        "missing_fields": ["NET_INTEREST_MARGIN"],
        "confidence": "high"
      }
    },
    {
      "code": "SH601939",
      "name": "建设银行",
      "type": "traditional_commercial",
      "score": 81.0,
      "rank": 2,
      "dimension_scores": {
        "D1_capital_preservation": 86.0,
        "D2_asset_quality": 78.0,
        "D3_profitability": 78.0,
        "D4_growth": 72.0,
        "D5_valuation": 85.0
      },
      "flags": [],
      "reasons": "HIGH_CONFIDENCE_PASS: consistent across all dimensions, strong capital position.",
      "source_tracking": {
        "quant": {
          "status": "PASS",
          "confidence": "high",
          "curiosity": "Strong CET1, stable metrics across the board"
        },
        "edge": [],
        "qual": [
          {
            "group": "large_state_owned",
            "assessment": "PASS",
            "group_rank": 2
          }
        ],
        "override": null
      },
      "data_quality": {
        "completeness": 0.91,
        "missing_fields": ["NET_INTEREST_MARGIN"],
        "confidence": "high"
      }
    },
    {
      "code": "SH600036",
      "name": "招商银行",
      "type": "integrated",
      "score": 80.0,
      "rank": 3,
      "dimension_scores": {
        "D1_capital_preservation": 82.0,
        "D2_asset_quality": 85.0,
        "D3_profitability": 85.0,
        "D4_growth": 75.0,
        "D5_valuation": 65.0
      },
      "flags": ["F10: Thin capital buffer: CAR 11.8% < 12%"],
      "reasons": "CONFLICT (Pattern C): edge flagged capital buffer, but qual analyst confirmed superior asset quality compensates. Top-tier profitability.",
      "source_tracking": {
        "quant": {
          "status": "PASS",
          "confidence": "high",
          "curiosity": "High ROE (14.2%) with elevated PB — quality premium may be justified"
        },
        "edge": [
          {
            "anomaly_type": "metric_mismatch",
            "severity": "low"
          }
        ],
        "qual": [
          {
            "group": "joint_stock",
            "assessment": "PASS",
            "group_rank": 1
          }
        ],
        "override": null
      },
      "data_quality": {
        "completeness": 0.91,
        "missing_fields": ["NET_INTEREST_MARGIN"],
        "confidence": "high"
      }
    }
  ],
  "rejected": [
    {
      "code": "SH600015",
      "name": "华夏银行",
      "layer": "quant",
      "reason": "NPL 3.2% exceeds hard threshold of 3.0%. PCR 135% in caution zone. UNANIMOUS_REJECT.",
      "dimension": "D2_asset_quality"
    },
    {
      "code": "SZ002807",
      "name": "江阴银行",
      "layer": "data_engineering",
      "reason": "Missing 4/6 critical fields. Insufficient data for screening.",
      "dimension": "data_quality"
    }
  ],
  "analyst_notes": "Synthesis notes: 8 HIGH_CONFIDENCE_PASS, 12 CONFLICT (resolved: 4 included, 8 excluded), 22 UNANIMOUS_REJECT. Bank type distribution: traditional_commercial=28, integrated=10, trading_ib=4. Sample output (ARCHITECTURE-v1) — actual results depend on live API data.",
  "warnings": [
    "NIM data missing for 12 banks (Q1 reports)",
    "Interest income ratio estimated for 8 banks via fee ratio proxy",
    "DPR data unavailable for 5 banks — D5 scored on PB + EPS yield only"
  ],
  "errors": []
}
